{
  "$schema": "https://json-schema.org/draft/2020-12/schema",
  "$id": "https://daggersearch.com/schemas/common/community.schema.json",
  "type": "object",
  "properties": {
    "id": { "$ref": "./id.schema.json" },
    "name": { "$ref": "./localized-string.schema.json" },
    "description": { "$ref": "./description.schema.json" },
    "personalities": {
      "type": "array",
      "items": { "$ref": "./localized-string.schema.json" }
    },
    "features": {
      "type": "array",
      "items": { "$ref": "./feature.schema.json" },
      "minItems": 1
    }
  },
  "required": ["id", "name", "description", "personalities", "features"],
  "additionalProperties": false
}
